{
  "schemaVersion": "ramcharitmanas-word-study-manifest-v1",
  "work": "Ramcharitmanas",
  "language": "en",
  "editorialStatus": "editorial-under-review",
  "label": "Independent close English word study",
  "sourceRef": "Pinned open source text and the public-domain 1925 Belvedere Press opening invocations; IITK Manas Supersite used only as a comparison witness",
  "sourceUrl": "https://manas.gitasupersite.in/",
  "note": "These contextual glosses and close renderings were prepared specifically for this edition. They are working editorial translations awaiting independent Awadhi and Sanskrit review, not quotations from IITK or a modern published translation.",
  "coverage": {
    "totalEntries": 1113,
    "annotatedEntries": 1113,
    "complete": true
  },
  "shards": [
    {
      "file": "bala-kanda/openings.v1.json",
      "kandaOrder": 1,
      "firstSequence": 1,
      "lastSequence": 12,
      "entryCount": 12,
      "sourceTextSha256": "476aae25d0e188884e875d667c8688e91ca8ed499572471cdf0d50d65b6de185",
      "generatedSha256": "20ebb41069f8b1846bd7aa039f8cca069e480f9f0bdaccb4fe2af2b828a69ebe"
    },
    {
      "file": "bala-kanda/0001-0008.v1.json",
      "kandaOrder": 1,
      "firstSequence": 13,
      "lastSequence": 20,
      "entryCount": 8,
      "sourceTextSha256": "20a9a2c85ff529a1d375d2ac54b92edac34288240c731e90ba0442f0d33215c7",
      "generatedSha256": "b504cfe62f62bdedb5d64e55add43bfbc9bfe3d759be3686e8170dd14c87dccf"
    },
    {
      "file": "bala-kanda/0009-0016.v1.json",
      "kandaOrder": 1,
      "firstSequence": 21,
      "lastSequence": 28,
      "entryCount": 8,
      "sourceTextSha256": "a1440f8e297eb23498161532acf40d12c9331160b623de085ba7446e8c39e839",
      "generatedSha256": "167f956f1d3cf84d83a0382eabaf0c21bd52044f7eb1acbb17f8a1fccaffe67f"
    },
    {
      "file": "bala-kanda/0017-0025.v1.json",
      "kandaOrder": 1,
      "firstSequence": 29,
      "lastSequence": 37,
      "entryCount": 9,
      "sourceTextSha256": "c8d3e1edcab6dca5fc63a729cf28203b05a1819ab88457bfc17dad962fd86a41",
      "generatedSha256": "0755b7eecd45a4491e82d0b93d793a97e779ca74da19e10708f1b0a555c5b65b"
    },
    {
      "file": "bala-kanda/0026-0030.v1.json",
      "kandaOrder": 1,
      "firstSequence": 38,
      "lastSequence": 42,
      "entryCount": 5,
      "sourceTextSha256": "7ae9ab2edbe34b4e62a6de500e7494089f5a288d60f37bf3eb85a64f6c35b455",
      "generatedSha256": "8dde1273f2021682a606dcc221c45e52e3b9925ebf465bb41e9b0469c7de8fa0"
    },
    {
      "file": "bala-kanda/0031-0035.v1.json",
      "kandaOrder": 1,
      "firstSequence": 43,
      "lastSequence": 47,
      "entryCount": 5,
      "sourceTextSha256": "c5eb03f17858267ed83402d1a6599e74990111a2f6e3896afc3b641cbc1a7982",
      "generatedSha256": "f7cc5329581fdef9a6bb6d5f0f03e6d269ee4941449d57c069e5b2f02b115d08"
    },
    {
      "file": "bala-kanda/0036-0040.v1.json",
      "kandaOrder": 1,
      "firstSequence": 48,
      "lastSequence": 52,
      "entryCount": 5,
      "sourceTextSha256": "8fea4938adac93e794dadff8c166850d414dd158fe82b08c74a0933efeec8b70",
      "generatedSha256": "de4c05c0b8139b0cfb49e5aae977769be370ed99cd627ab09bccfd0ab5ba0e80"
    },
    {
      "file": "bala-kanda/0041-0045.v1.json",
      "kandaOrder": 1,
      "firstSequence": 53,
      "lastSequence": 57,
      "entryCount": 5,
      "sourceTextSha256": "e0064b3edc683e201388f05d98449fe7773b8690a4a95187f590484591b0db67",
      "generatedSha256": "f05906b4169c0badc0d502c9c82298824080d75725725aa41e8b53de146cc231"
    },
    {
      "file": "bala-kanda/0046-0050.v1.json",
      "kandaOrder": 1,
      "firstSequence": 58,
      "lastSequence": 62,
      "entryCount": 5,
      "sourceTextSha256": "5dd064dfa7be086a5065f78814ae96211850f9d5a4f49e889367a6e372878234",
      "generatedSha256": "7b2b7c6970dd6f4122cf549da84d4df41e49f14255dd4aea4de20adf2a0892e0"
    },
    {
      "file": "bala-kanda/0051-0055.v1.json",
      "kandaOrder": 1,
      "firstSequence": 63,
      "lastSequence": 67,
      "entryCount": 5,
      "sourceTextSha256": "cbc99e0de6746dfcb97196bb7e79fafdc39a4f9542ed3439d9163602aa7fd5c9",
      "generatedSha256": "c21506604dcf9a9257f8a3900c84f46861bb6524544730a90df1b539363572c1"
    },
    {
      "file": "bala-kanda/0056-0060.v1.json",
      "kandaOrder": 1,
      "firstSequence": 68,
      "lastSequence": 72,
      "entryCount": 5,
      "sourceTextSha256": "c73fc035395d2d5f604f0c83a37be87e4a1959dfa79a565bd5b026e49f8b0c88",
      "generatedSha256": "f74d72963be2446fc39ad27663e179aac70388274e5f8283294a270a2c39f4e8"
    },
    {
      "file": "bala-kanda/0061-0065.v1.json",
      "kandaOrder": 1,
      "firstSequence": 73,
      "lastSequence": 77,
      "entryCount": 5,
      "sourceTextSha256": "360d009677dfaa03f8148c87640f5c0da8cb71220dff0addb4fef0239d7af912",
      "generatedSha256": "ea539f73fa9b27b55fce0dcb33f5dc69ac842532e0ab3a1bc21df98c6ccf1e24"
    },
    {
      "file": "bala-kanda/0066-0070.v1.json",
      "kandaOrder": 1,
      "firstSequence": 78,
      "lastSequence": 82,
      "entryCount": 5,
      "sourceTextSha256": "f79f3562d550d8868105456b3e88fb1ee7fef0a431845b307bf62870e486a79a",
      "generatedSha256": "74912631753e4f8fb179bbf9680f70eec9085b48fbf9e4629aa79410f1c94d65"
    },
    {
      "file": "bala-kanda/0071-0075.v1.json",
      "kandaOrder": 1,
      "firstSequence": 83,
      "lastSequence": 87,
      "entryCount": 5,
      "sourceTextSha256": "cf9dc6ea161db1e29a5112bb32ce01fa8c9b432f2fb09138afa36cb277f965ee",
      "generatedSha256": "862df21c60f85202162a672f8d02814a817bd19e6f1a34e56f0a369ab78b1a6d"
    },
    {
      "file": "bala-kanda/0076-0080.v1.json",
      "kandaOrder": 1,
      "firstSequence": 88,
      "lastSequence": 92,
      "entryCount": 5,
      "sourceTextSha256": "81db54d847272d4defa9bad2e9f2867b757b47e7bc8a634fdd0f3ec8772fe188",
      "generatedSha256": "968ec05275955bef0fc058dd4b30c3c09fde0335f0deaafd0cad840960459f9a"
    },
    {
      "file": "bala-kanda/0081-0085.v1.json",
      "kandaOrder": 1,
      "firstSequence": 93,
      "lastSequence": 97,
      "entryCount": 5,
      "sourceTextSha256": "4e4841e7863eb762d766bc0a2a32d3cbeb7edf6228187c6b74d24c5225221e13",
      "generatedSha256": "fbec27c61f60279dcecc0605de3ed8d82b7cd74caab0de9cf61acde897688791"
    },
    {
      "file": "bala-kanda/0086-0090.v1.json",
      "kandaOrder": 1,
      "firstSequence": 98,
      "lastSequence": 102,
      "entryCount": 5,
      "sourceTextSha256": "8420a74d254c723e411433e80877e9bd54f29d3c6ba06f0e7e20aa91d0f13fde",
      "generatedSha256": "f27e7e1f02c87d8e888e3ca186a8bd12d791ca50dc2338cdc8dd519f378dda0b"
    },
    {
      "file": "bala-kanda/0091-0095.v1.json",
      "kandaOrder": 1,
      "firstSequence": 103,
      "lastSequence": 107,
      "entryCount": 5,
      "sourceTextSha256": "11a6ba1799f600d45112f21c1ac20ea8b2dba1fe02f2b42013b06bdfcad56e59",
      "generatedSha256": "2476075a20ffffeea9a1326f5e2cbaa5775c4ab03a726407d480a209867b3cdd"
    },
    {
      "file": "bala-kanda/0096-0100.v1.json",
      "kandaOrder": 1,
      "firstSequence": 108,
      "lastSequence": 112,
      "entryCount": 5,
      "sourceTextSha256": "cd6fa70cab4fa17709b0bb69f627c9a275cfae98ac172c065edafdf9dedfcdd5",
      "generatedSha256": "f02720f4e8d86982f81c0459a8efd0b2447199d1eba11d3084936b55e5b2cf3d"
    },
    {
      "file": "bala-kanda/0101-0105.v1.json",
      "kandaOrder": 1,
      "firstSequence": 113,
      "lastSequence": 117,
      "entryCount": 5,
      "sourceTextSha256": "8022f12c9ce558acc6c4c2e5a656929b1435d68f1039bb3c351feab6e695d44f",
      "generatedSha256": "19be0aae791df82d54ebcdbe75a0e62c264232bf7bbd4c41295434b4af6e2af9"
    },
    {
      "file": "bala-kanda/0106-0110.v1.json",
      "kandaOrder": 1,
      "firstSequence": 118,
      "lastSequence": 122,
      "entryCount": 5,
      "sourceTextSha256": "dc400364096e94bbcb392812f7460c9e2229590f16e52e81a002e29181f570a9",
      "generatedSha256": "aa08862f22495e7e821065608d7f9b306dd4c80026032522e965415d649cd7d1"
    },
    {
      "file": "bala-kanda/0111-0115.v1.json",
      "kandaOrder": 1,
      "firstSequence": 123,
      "lastSequence": 127,
      "entryCount": 5,
      "sourceTextSha256": "9a612ed5b5369e6bb371dc342dd837ab6e7037de4975b5b91c3f36b1816c1540",
      "generatedSha256": "e731a558424c280531172125d4da4c272d5ffd9c29282d51d0fc9c21a47a8b24"
    },
    {
      "file": "bala-kanda/0116-0120.v1.json",
      "kandaOrder": 1,
      "firstSequence": 128,
      "lastSequence": 132,
      "entryCount": 5,
      "sourceTextSha256": "181ae728794fbb3b1d455c51e515e96afc503d537feb10c89a404999ed3ce3bb",
      "generatedSha256": "02a1219367145a6487caa06a3b1301bd01519406d1b4d8e784c95676273cc458"
    },
    {
      "file": "bala-kanda/0121-0125.v1.json",
      "kandaOrder": 1,
      "firstSequence": 133,
      "lastSequence": 137,
      "entryCount": 5,
      "sourceTextSha256": "8fd726817f40199c9ae2c0123def2c2cab2bc9f86a1913e3a064a9a857b8b4d2",
      "generatedSha256": "0c09ccc314c397205c1f26d87c059010ee8c4a421d1257b032b83af6c7f377ff"
    },
    {
      "file": "bala-kanda/0126-0130.v1.json",
      "kandaOrder": 1,
      "firstSequence": 138,
      "lastSequence": 142,
      "entryCount": 5,
      "sourceTextSha256": "5147365b91f8713341bb2310af260c378a05a079eff45d8d05db0a37eea0dc75",
      "generatedSha256": "2ab2fe8d06bf1a78319649f3bf887d38ccd50492ebd5beccf2ca052146d1cd54"
    },
    {
      "file": "bala-kanda/0131-0135.v1.json",
      "kandaOrder": 1,
      "firstSequence": 143,
      "lastSequence": 147,
      "entryCount": 5,
      "sourceTextSha256": "a385aa0a8d55547bfdaab87574bfd24b906bb1747b6accf35b583ad2124914e7",
      "generatedSha256": "af7f033b2fbc995f5ff31684858d392a611849363a6f75310c1cc189e065b0f1"
    },
    {
      "file": "bala-kanda/0136-0140.v1.json",
      "kandaOrder": 1,
      "firstSequence": 148,
      "lastSequence": 152,
      "entryCount": 5,
      "sourceTextSha256": "64c411790708e9ea53c5f42904acb077e19ee1b3079007ac1486e676d07c44e7",